{
  "description": "Introducing 8M, a special EP collaboration that celebrates International Women's Day. Executive produced by sweetman.eth, 8M is a testament to the power of women in music.\n\nEach track on the EP tells a story, showcasing the diverse talents of these female musicians and their unique perspectives opening with \"DejaVu\" by Yaxx Castillo* followed by \"Hoy llueve\" by Sol Siete*, both are in Spanish. The third & fourth tracks \"Look at me\" by Nena1992* and \"Out the Blue\" by Calispeedway are in English and feature hip-hop influences. Finally, the EP closes with an instrumental track with live trumpet \"Genesis\" by Little Miss Music, a drop that marks her first music NFT.\n\nWith its blend of Latin, electronic and hip-hop influences, 8M is a must-listen for anyone who loves music that pushes boundaries and breaks the mold.\n\n*Artist from Latin America\n\nPresentamos 8M, una colaboración especial de EP que celebra el Día Internacional de la Mujer. Producido por sweetman.eth, 8M es un testimonio del poder de las mujeres en la música.\n\nCada pista del EP cuenta una historia, mostrando los diversos talentos de estas mujeres músicas y sus perspectivas únicas. Comenzando con \"DejaVu\" de Yaxx Castillo* seguido por \"Hoy llueve\" de Sol Siete*, ambas en español. Las pistas tercera y cuarta, \"Look at me\" de Nena1992* y \"Out the Blue\" de Calispeedway, están en inglés y presentan influencias de hip-hop. Finalmente, el EP se cierra con \"Genesis\" de Little Miss Music, un lanzamiento que marca su primer NFT de música.\n\nCon su combinación de influencias latinas, electrónicas y de hip-hop, 8M es una escucha obligada para cualquier persona que ame la música que empuja los límites y rompe los moldes.\n\n*Artistas de América Latina.",
  "image": "ipfs://bafybeidziailzilmrge7c55vd5rxtuos35esfycen7fksakc76tqqolf5a/cover.jpg",
  "name": "8M",
  "animation_url": "https://cdn.warpsound.ai/ipfs/QmVYW5vHaV322Kvp2So5ErngP1PrDUneYqo4e9TNygAGSn?playlist-url=https://nftstorage.link/ipfs/bafkreiavkifytdhtbgpk2tkicnpv4dukj6lvk5qb4hlz7vy7nsxh7fxdf4",
  "external_url": "https://march8.xyz",
  "attributes": {
    "Yaxx Castillo": "DejaVu",
    "Sol Siete": "Hoy llueve",
    "Nena1992": "Look at me",
    "Calispeedway": "Out the Blue",
    "Little Miss Music": "Genesis"
  }
}